{
  "reference": {
    "userId": "someuser",
    "materializedTaskId": "2f42383f-72be-4333-98b2-2616958883b7",
    "imageEntityId": "someimage"
  },
  "status": "SUBMITTED",
  "typeROI": "IMPLICIT",
  "properties": {
    "implicit": 
    {
      "implicitGeometryPointer": "POINT", 
      "implicitRelationWithRoi": "INSIDE",
      "roiProperties": 
      {
        "worldCoordinates": {"x": -23.68108558654785, "y": -59.147117614746094, "z": -18.659999847972024}, 
        "imageCoordinates": {"i": 151, "j": 140, "k": 52}
      }
    }
  }
}